{
  "schema_version": "1.0",
  "generated_at": "2026-07-17T00:00:00Z",
  "git_commit": "61d2e96a605a5c13cc3ac5d6db6d145517cb02f5",
  "dataset_mode": "candidate",
  "operational_status": "non_operational",
  "artifacts": [
    {
      "kind": "proposal_editable_source",
      "relative_path": "docs/submission/2026-geohackathon/source/FloodGuard_GeoHackathon_2026_Proposal.docx",
      "media_type": "application/vnd.openxmlformats-officedocument.wordprocessingml.document",
      "sha256": "0000000000000000000000000000000000000000000000000000000000000000"
    },
    {
      "kind": "proposal_visual_reference",
      "relative_path": "docs/submission/2026-geohackathon/source/FloodGuard_GeoHackathon_2026_Proposal.pdf",
      "media_type": "application/pdf",
      "sha256": "0000000000000000000000000000000000000000000000000000000000000000"
    },
    {
      "kind": "proposal_source_fidelity_contract",
      "relative_path": "docs/submission/2026-geohackathon/source/artifact.md",
      "media_type": "text/markdown",
      "sha256": "0000000000000000000000000000000000000000000000000000000000000000"
    },
    {
      "kind": "proposal_source",
      "relative_path": "docs/submission/2026-geohackathon/proposal.md",
      "media_type": "text/markdown",
      "sha256": "0000000000000000000000000000000000000000000000000000000000000000"
    },
    {
      "kind": "application_form_answers",
      "relative_path": "docs/submission/2026-geohackathon/application-form-answers.md",
      "media_type": "text/markdown",
      "sha256": "0000000000000000000000000000000000000000000000000000000000000000"
    },
    {
      "kind": "claim_to_evidence_matrix",
      "relative_path": "docs/submission/2026-geohackathon/claim-to-evidence.md",
      "media_type": "text/markdown",
      "sha256": "0000000000000000000000000000000000000000000000000000000000000000"
    },
    {
      "kind": "model_card",
      "relative_path": "docs/submission/2026-geohackathon/model-card.md",
      "media_type": "text/markdown",
      "sha256": "0000000000000000000000000000000000000000000000000000000000000000"
    },
    {
      "kind": "validation_summary",
      "relative_path": "docs/submission/2026-geohackathon/validation-summary.md",
      "media_type": "text/markdown",
      "sha256": "0000000000000000000000000000000000000000000000000000000000000000"
    },
    {
      "kind": "bilingual_action_brief",
      "relative_path": "docs/submission/2026-geohackathon/bilingual-action-brief-reference.md",
      "media_type": "text/markdown",
      "sha256": "0000000000000000000000000000000000000000000000000000000000000000"
    },
    {
      "kind": "architecture_api_inventory",
      "relative_path": "docs/submission/2026-geohackathon/architecture-and-api-inventory.md",
      "media_type": "text/markdown",
      "sha256": "0000000000000000000000000000000000000000000000000000000000000000"
    },
    {
      "kind": "offline_demo_instructions",
      "relative_path": "docs/submission/2026-geohackathon/offline-demo-instructions.md",
      "media_type": "text/markdown",
      "sha256": "0000000000000000000000000000000000000000000000000000000000000000"
    },
    {
      "kind": "test_results_receipt",
      "relative_path": "docs/submission/2026-geohackathon/evidence/test-results.json",
      "media_type": "application/json",
      "sha256": "0000000000000000000000000000000000000000000000000000000000000000"
    },
    {
      "kind": "visual_public_390x844",
      "relative_path": "docs/visual-qa/proposal-stage/public-390x844.png",
      "media_type": "image/png",
      "sha256": "0000000000000000000000000000000000000000000000000000000000000000"
    },
    {
      "kind": "visual_public_map_430x932",
      "relative_path": "docs/visual-qa/proposal-stage/public-map-430x932.png",
      "media_type": "image/png",
      "sha256": "0000000000000000000000000000000000000000000000000000000000000000"
    },
    {
      "kind": "visual_command_1024x768",
      "relative_path": "docs/visual-qa/proposal-stage/command-1024x768.png",
      "media_type": "image/png",
      "sha256": "0000000000000000000000000000000000000000000000000000000000000000"
    },
    {
      "kind": "visual_command_1440x900",
      "relative_path": "docs/visual-qa/proposal-stage/command-1440x900.png",
      "media_type": "image/png",
      "sha256": "0000000000000000000000000000000000000000000000000000000000000000"
    },
    {
      "kind": "visual_command_1536x1024",
      "relative_path": "docs/visual-qa/proposal-stage/command-1536x1024.png",
      "media_type": "image/png",
      "sha256": "0000000000000000000000000000000000000000000000000000000000000000"
    },
    {
      "kind": "visual_studio_2048x1152",
      "relative_path": "docs/visual-qa/proposal-stage/studio-2048x1152.png",
      "media_type": "image/png",
      "sha256": "0000000000000000000000000000000000000000000000000000000000000000"
    },
    {
      "kind": "three_model_gate_receipt",
      "relative_path": "docs/validation/controlled_three_model_gate_receipt.json",
      "media_type": "application/json",
      "sha256": "0000000000000000000000000000000000000000000000000000000000000000"
    },
    {
      "kind": "geoai_proof_receipt",
      "relative_path": "services/geoai-runner/evidence/geoai-proof-receipt.json",
      "media_type": "application/json",
      "sha256": "0000000000000000000000000000000000000000000000000000000000000000"
    },
    {
      "kind": "geoai_probability_thumbnail",
      "relative_path": "services/geoai-runner/evidence/geoai-probability-thumbnail.png",
      "media_type": "image/png",
      "sha256": "0000000000000000000000000000000000000000000000000000000000000000"
    }
  ],
  "test_suites": [
    {
      "name": "root-python",
      "command": ".venv/Scripts/python.exe -m pytest --junitxml=.tmp/proposal-evidence/root-python.xml",
      "result": "not_run",
      "passed": 0,
      "skipped": 0
    },
    {
      "name": "api",
      "command": "services/api/.venv/Scripts/python.exe -m pytest services/api/tests --junitxml=.tmp/proposal-evidence/api.xml",
      "result": "not_run",
      "passed": 0,
      "skipped": 0
    },
    {
      "name": "contracts",
      "command": "pnpm --dir packages/contracts test --reporter=junit --outputFile=../../.tmp/proposal-evidence/contracts.xml",
      "result": "not_run",
      "passed": 0,
      "skipped": 0
    },
    {
      "name": "web-unit",
      "command": "pnpm --dir apps/web test --reporter=junit --outputFile=../../.tmp/proposal-evidence/web-unit.xml",
      "result": "not_run",
      "passed": 0,
      "skipped": 0
    },
    {
      "name": "frontend-quality-and-offline",
      "command": ".venv/Scripts/python.exe scripts/run_check_with_junit.py --suite frontend-quality-and-offline --output .tmp/proposal-evidence/frontend.xml -- pnpm verify:frontend",
      "result": "not_run",
      "passed": 0,
      "skipped": 0
    },
    {
      "name": "geoai-normal",
      "command": "services/geoai-runner/.venv/Scripts/python.exe -m pytest services/geoai-runner/tests -m \"not geoai_smoke\" --junitxml=.tmp/proposal-evidence/geoai-normal.xml",
      "result": "not_run",
      "passed": 0,
      "skipped": 0
    },
    {
      "name": "geoai-real-smoke",
      "command": "powershell -NoProfile -Command \"$env:RUN_GEOAI_SMOKE='1'; $env:FLOODGUARD_PROOF_COMMIT='61d2e96a605a5c13cc3ac5d6db6d145517cb02f5'; $env:GEOAI_PROOF_OUTPUT_DIR='.tmp/proposal-geoai-evidence-61d2e96'; & 'services/geoai-runner/.venv/Scripts/python.exe' -m pytest services/geoai-runner/tests/test_geoai_smoke.py -m geoai_smoke --junitxml=.tmp/proposal-evidence/geoai-real-smoke.xml\"",
      "result": "not_run",
      "passed": 0,
      "skipped": 0
    }
  ],
  "geoai_proof": {
    "geoai_version": "0.41.1",
    "feature_stack_id": "clip_linear_uint8_v1-8-band",
    "preprocessing_id": "clip_linear_uint8_v1",
    "input_manifest_sha256": "c401c3d618f6bcba14fcd692af94416712ca8d227580112e67ecf87860dfeb11",
    "output_probability_sha256": "bd8fbdaf288e8dc696ee594536f510bfb8df5071d4a82b7826c3acc91c0347cd",
    "validation_status": "passed",
    "aggregation_status": "report_only",
    "processing_allowed": true,
    "can_feed_decision_layer": false,
    "reason_blocked": "Synthetic candidate proof cannot feed the decision layer."
  }
}
